<?xml version="1.0" encoding="utf-8" ?>
<DialoguesStructuresDatas xmlns:xsi="http://www.w3.org/2001/XMLSchema-instance" xsi:noNamespaceSchemaLocation="DialoguesStructuresDatas.xsd">

   <DialoguesStructureDatas Id="Godric">

      <Dialogue Id="Godric_Greeting_Ring">
         <Conditions>
            <DialogueNeverDone>Godric_Greeting</DialogueNeverDone>
            <DialogueNeverDone>Godric_Greeting_Ring</DialogueNeverDone>
            <PlayerHasItem Id="Ring_Godric" MinQuantity="1"/>
         </Conditions>
      </Dialogue>

      <Dialogue Id="Godric_Greeting">
         <Conditions>
            <DialogueNeverDone>Godric_Greeting</DialogueNeverDone>
            <DialogueNeverDone>Godric_Greeting_Ring</DialogueNeverDone>
         </Conditions>
      </Dialogue>

      <Dialogue Id="Godric_WaitingRing">
         <Conditions>
            <DialogueNeverDone>Godric_RetrieveRing</DialogueNeverDone>
            <DialogueNeverDone>Godric_Greeting_Ring</DialogueNeverDone>
            <PlayerDoesntHaveItem Id="Ring_Godric"/>
         </Conditions>
      </Dialogue>

      <Dialogue Id="Godric_RetrieveRing">
         <Conditions>
            <PlayerHasItem Id="Ring_Godric" MinQuantity="1"/>
         </Conditions>
      </Dialogue>

      <Dialogue Id="Godric_PostRetrieveRing">
      </Dialogue>
      
   </DialoguesStructureDatas>

</DialoguesStructuresDatas>