<?xml version="1.0" encoding="utf-8" ?>
<DialoguesStructuresDatas xmlns:xsi="http://www.w3.org/2001/XMLSchema-instance" xsi:noNamespaceSchemaLocation="DialoguesStructuresDatas.xsd">

   <DialoguesStructureDatas Id="OfferingStone">

      <SoldItems>
         <ItemId>GodsEmblem</ItemId>
      </SoldItems>
      
      <Dialogue Id="OfferingStone_ItemLeft">
         <Conditions>
            <!-- TODO: Item to sold left. -->
         </Conditions>
      </Dialogue>

      <Dialogue Id="OfferingStone_NoItemLeft">
         <Conditions>
         </Conditions>
      </Dialogue>
      
   </DialoguesStructureDatas>

</DialoguesStructuresDatas>